{
  "artifact_attestation_refs": [],
  "authority_refs": [
    "research_v3/RESEARCH_CONTRACT_V3.json",
    "data/RESEARCH_SCOPE_GOVERNANCE_V1.json",
    "evidence/MECHANISM_SCOPE_REGISTRY_V1.json",
    "evidence/V2_CONSUMED_IDENTITY_SCOPE_AUDIT_V1.json",
    "data/AUTONOMOUS_UNIVERSE_GOVERNOR_V1.json",
    "data/ADAPTIVE_DATA_ACQUISITION_POLICY_V1.json",
    "research_v3/SEARCH_BUDGET_GOVERNANCE_V2.json"
  ],
  "basis": {
    "accounting": {
      "economic_outcomes_opened": 27,
      "v2_attempts_used": 19,
      "v2_search_budget_remaining": 65
    },
    "discovery_ledger_sha256": "e7c6fc2ff65e4e422cb00e482aa9aaf7eb5ce6282586a89fb16e016776a4773d",
    "research_head": "9bdba90453bf50be3c25c2c2b9c85795a5c2b523"
  },
  "causal_contract": {
    "causal_entry_admission": true,
    "chronological_incremental_replay": true,
    "future_information_forbidden": true,
    "learned_procedure_freeze_before_outer_outcome": true,
    "protected_forward_leakage_forbidden": true
  },
  "data_bindings": [],
  "data_policy": {
    "minimal_acquisition_request": {
      "end_utc": "2026-09-13T23:59:59Z",
      "fields": [
        "open",
        "high",
        "low",
        "close",
        "volume"
      ],
      "information_gain_justification": "The current 10-symbol V6 is not the global universe and mechanism-family closure is not satisfied; this minimal 8-week M5 data slice is the smallest authorized frontier extension that tests whether SESSION_GAP_REVERSION has structural breadth beyond the exact observed sample.",
      "resolution": "M5",
      "start_utc": "2026-07-20T00:00:00Z",
      "symbols": [
        "USTN2YR-F",
        "TLT.US",
        "NVDA.US-24",
        "VIX",
        "HSTECH",
        "ADAUSD",
        "Gasoline",
        "EURUSD",
        "USDCAD",
        "MXNJPY",
        "IWM.US",
        "DOTUSD"
      ]
    },
    "new_market_data_requested": true,
    "no_default_multi_year_download": true,
    "user_selects_symbols_or_horizon": false
  },
  "decision": {
    "candidate_criteria": [
      "ACCESSIBILITY",
      "MIN_EXECUTABLE_VOLUME",
      "DIRECTIONAL_MARGIN_FEASIBILITY",
      "SHORTABILITY",
      "DATA_AVAILABILITY",
      "EXPECTED_INFORMATION_GAIN",
      "REDUNDANCY",
      "CONSERVATIVE_FRICTION"
    ],
    "identity_policy": "DO_NOT_RERUN_EXACT_IDENTITY_V2-C031_OR_ANY_OBSERVED_EXACT_IDENTITY",
    "mechanism_family": "SESSION_GAP_REVERSION",
    "must_not": [
      "LIVE_ORDERS",
      "COMPETITION_START",
      "PROTECTED_FORWARD",
      "NEW_ECONOMIC_OUTCOME",
      "RERUN_EXACT_STAGE_B"
    ],
    "research_decision": "MINIMAL_STRUCTURAL_FRONTIER_EXPANSION",
    "screening_policy": "BROKER_NATIVE_ADJACENT_SYMBOLS_ONLY",
    "stop_conditions": [
      "adjacent frontier fails data/feasibility gate",
      "information gain drops below minimal expected threshold",
      "family-level evidence indicates mechanism is structurally absent",
      "budget or time exceeds policy"
    ],
    "universe_selection": {
      "frequency": "M5",
      "method": "same mechanism + same detection logic on structurally adjacent frontier; do not re-use prior exact candidate implementation",
      "symbol_set": [
        "USTN2YR-F",
        "TLT.US",
        "NVDA.US-24",
        "VIX",
        "HSTECH",
        "ADAUSD",
        "Gasoline",
        "EURUSD",
        "USDCAD",
        "MXNJPY",
        "IWM.US",
        "DOTUSD"
      ],
      "window_utc": {
        "end_utc": "2026-09-13T23:59:59Z",
        "start_utc": "2026-07-20T00:00:00Z"
      }
    }
  },
  "economic_effect": {
    "consume_v2_attempt": 0,
    "create_new_v2_identity": false,
    "open_economic_outcome": false
  },
  "next_research_state": {
    "gating": "require current head green and data availability before feature generation",
    "next_action": "SCREEN_ADJACENT_BROKER_SYMBOLS_FOR_SESSION_GAP_REVERSION_WITH_M5_8W_DATA_WITHOUT_RERUNNING_EXACT_C031",
    "scope": "mechanism-family expansion only; no live orders; no economic outcome; no protected-forward; no exact rerun",
    "status": "READY_FOR_MINIMAL_STRUCTURAL_SCREENING",
    "wave": "STRUCTURAL_EXTENSION_WAVE_01"
  },
  "objective": {
    "class": "BROKER_NATIVE_UNIVERSE_INFORMATION_GAIN_AND_DATA_SCOPE",
    "goal": "Assess whether SESSION_GAP_REVERSION generalizes beyond the current 10-symbol V6 by minimal structural screening of adjacent broker-native symbols, without rerunning exact C031 or any observed identity.",
    "information_gain_rationale": "C031 is the only discovery survivor among the current 10, but exact failures on broader families never close the family. The governing policy requires the highest information legal action: minimal frontier expansion around the same mechanism family, using the existing 8-week M5 acquisition rule and only structurally adjacent symbols. This maximizes information gain while preserving anti-ruin, avoiding duplicate exact tests, and staying within the non-economic research-only gate."
  },
  "proposal_id": "P-20260924-C031-GAP-WAVE-01",
  "provider": {
    "kind": "GITHUB_COPILOT_CLI_GENERAL_REASONING",
    "model": "auto",
    "provider_version": "MXM_GENERAL_AI_REASONING_PROVIDER_V2",
    "reasoning_request_id": "reason_a8b81cef686ff74cf678e7e25193f43f",
    "vendor": "GitHub Copilot"
  },
  "publication": {
    "apply_to_next_state": true
  },
  "safety": {
    "competition_start_authorized": false,
    "live_orders_authorized": false,
    "protected_forward_opened": false
  },
  "schema": "mxm.greenfield.general-ai-research-proposal.v1",
  "scope_law": {
    "mechanism_family_closure_claims": [],
    "refund_observed_attempts": false,
    "rerun_exact_observed_identity": false
  }
}
