{
  "artifact_attestation_refs": [],
  "authority_refs": [
    "research_v3/SESSION_GAP_STRUCTURAL_EXTENSION_WAVE_01_FREEZE_V1.json",
    "evidence/SESSION_GAP_STRUCTURAL_EXTENSION_WAVE_01_REPORT_V1.json",
    "research_v3/SEARCH_BUDGET_GOVERNANCE_V2.json",
    "data/CAPITAL_FLOW_AWARE_CAUSAL_GOVERNOR_V1.json",
    "research_v3/RESEARCH_CONTRACT_V3.json"
  ],
  "basis": {
    "accounting": {
      "economic_outcomes_opened": 27,
      "v2_attempts_used": 19,
      "v2_search_budget_remaining": 65
    },
    "discovery_ledger_sha256": "e7c6fc2ff65e4e422cb00e482aa9aaf7eb5ce6282586a89fb16e016776a4773d",
    "research_head": "41e838c76bda3c94cbbb1b7956649d1ee871126a"
  },
  "causal_contract": {
    "causal_entry_admission": true,
    "chronological_incremental_replay": true,
    "future_information_forbidden": true,
    "learned_procedure_freeze_before_outer_outcome": true,
    "protected_forward_leakage_forbidden": true
  },
  "data_bindings": [
    "evidence/C031_STRUCTURAL_EXTENSION_WAVE_01_CAPTURE_ACCEPTANCE_V1.json",
    "research_v3/SESSION_GAP_STRUCTURAL_EXTENSION_WAVE_01_FREEZE_V1.json"
  ],
  "data_policy": {
    "new_market_data_requested": false,
    "no_default_multi_year_download": true,
    "user_selects_symbols_or_horizon": false
  },
  "decision": {
    "action": "EXECUTE_FROZEN_SELECTED_SIX_PANEL_PROSPECTIVE_STRUCTURAL_SCREEN",
    "interpretation": "Produce structural evidence only. Do not compute notional economic PnL, create an economic candidate identity, open protected evidence, claim family exhaustion, rerun C031 Stage-B, or expand to a new universe in this operation.",
    "method": "Evaluate only the frozen six-panel specification using the existing canonical capture and inherited causal semantics; do not alter symbols, thresholds, horizon, features, or execution rules.",
    "progression_rule": "Only a separately authorized later decision may use the resulting structural screen to justify broader-universe research or economic progression.",
    "scope_ref": "research_v3/SESSION_GAP_STRUCTURAL_EXTENSION_WAVE_01_FREEZE_V1.json",
    "validation_requirements": [
      "chronological signal admission",
      "complete coverage and chronology checks",
      "next-observed-M5 entry semantics",
      "minimum observed gap and scale-window requirements",
      "explicit conservative friction and execution treatment",
      "same-symbol overlap prevention",
      "multiple-testing correction across the frozen panel"
    ]
  },
  "economic_effect": {
    "consume_v2_attempt": 0,
    "create_new_v2_identity": false,
    "open_economic_outcome": false
  },
  "next_research_state": {
    "data_status": "NO_NEW_MARKET_DATA_REQUIRED_FOR_THIS_FREEZE",
    "guardrails": [
      "NO_RERUN_C031_STAGE_B",
      "NO_EXACT_IDENTITY_RERUN",
      "NO_MECHANISM_FAMILY_EXHAUSTION_CLAIM",
      "NO_PROTECTED_FORWARD_OPENING",
      "NO_COMPETITION_START",
      "NO_LIVE_ORDERS"
    ],
    "implementation_id": "c031-structural-extension-selected-six-panel-freeze-v1",
    "next_action": "EXECUTE_FROZEN_SELECTED_SIX_PANEL_PROSPECTIVE_STRUCTURAL_SCREEN",
    "research_mode": "STRUCTURAL_NON_ECONOMIC",
    "status": "PROSPECTIVE_SCREEN_READY",
    "success_condition": "The frozen panel is evaluated chronologically with complete coverage, explicit friction and execution semantics, and corrected multiple-testing accounting before any economic candidate is considered."
  },
  "objective": {
    "class": "NON_ECONOMIC_STRUCTURAL_VALIDATION",
    "goal": "Execute the already frozen selected-six-panel session-gap prospective structural screen without opening a new economic identity or rerunning C031 Stage-B.",
    "information_gain_rationale": "This is the highest-information legal action because the frozen panel targets structurally informative symbols from the completed wave while preserving chronology, execution semantics, friction accounting, and multiple-testing discipline before any broader-universe expansion or economic progression."
  },
  "proposal_id": "P-20260924-SESSIONGAP-SIXPANEL-STRUCTURAL-VALIDATE-V2",
  "provider": {
    "kind": "GITHUB_COPILOT_CLI_GENERAL_REASONING",
    "model": "auto",
    "provider_version": "MXM_GENERAL_AI_REASONING_PROVIDER_V2",
    "reasoning_request_id": "reason_a5c67cb76c74affb913fc61282c9b25e",
    "vendor": "GitHub Copilot"
  },
  "publication": {
    "apply_to_next_state": true
  },
  "safety": {
    "competition_start_authorized": false,
    "live_orders_authorized": false,
    "protected_forward_opened": false
  },
  "schema": "mxm.greenfield.general-ai-research-proposal.v1",
  "scope_law": {
    "mechanism_family_closure_claims": [],
    "refund_observed_attempts": false,
    "rerun_exact_observed_identity": false
  }
}
