{
  "artifact_attestation_refs": [],
  "authority_refs": [
    "data/AUTONOMOUS_UNIVERSE_GOVERNOR_V1.json",
    "data/BROKER_NATIVE_COMPETITION_UNIVERSE_ACCEPTANCE_V2.json",
    "data/BROKER_NATIVE_COMPETITION_STRUCTURAL_MAP_SUMMARY_V2.json",
    "data/ADAPTIVE_DATA_ACQUISITION_POLICY_V1.json",
    "evidence/SESSION_GAP_SIX_PANEL_INDEPENDENT_OUTER_INTERPRETATION_V1.json",
    "research_v3/SEARCH_BUDGET_GOVERNANCE_V2.json",
    "research_v3/RESEARCH_CONTRACT_V3.json"
  ],
  "basis": {
    "accounting": {
      "economic_outcomes_opened": 27,
      "v2_attempts_used": 19,
      "v2_search_budget_remaining": 65
    },
    "discovery_ledger_sha256": "e7c6fc2ff65e4e422cb00e482aa9aaf7eb5ce6282586a89fb16e016776a4773d",
    "research_head": "8d17186c51c8a2ab2573efed9ad56a2ab25a3c24"
  },
  "causal_contract": {
    "causal_entry_admission": true,
    "chronological_incremental_replay": true,
    "future_information_forbidden": true,
    "learned_procedure_freeze_before_outer_outcome": true,
    "protected_forward_leakage_forbidden": true
  },
  "data_bindings": [
    "data/BROKER_NATIVE_COMPETITION_UNIVERSE_ACCEPTANCE_V2.json#account_fingerprint_sha256",
    "data/BROKER_NATIVE_COMPETITION_UNIVERSE_ACCEPTANCE_V2.json#directional_feasibility",
    "data/AUTONOMOUS_UNIVERSE_GOVERNOR_V1.json#screening_inputs"
  ],
  "data_policy": {
    "minimal_acquisition_request": {
      "end_utc": "2026-09-13T23:59:59Z",
      "fields": [
        "time_utc",
        "open",
        "high",
        "low",
        "close",
        "tick_volume"
      ],
      "information_gain_justification": "This is the smallest practical cross-asset, cross-schedule development wave that expands beyond the observed C031 and six-symbol scopes while providing enough active weeks to estimate structural event density, response heterogeneity, and portability without opening economic outcomes.",
      "resolution": "M5",
      "source_domain": "PEPPERSTONE_ACCOUNT_VIA_CTRADER_OPEN_API",
      "start_utc": "2026-07-20T00:00:00Z",
      "symbols": [
        "XAUUSD",
        "XAGUSD",
        "BTCUSD",
        "AAPL.US",
        "AMZN.US",
        "MSFT.US",
        "META.US",
        "US30",
        "GER30",
        "UK100",
        "AUDJPY",
        "NZDUSD"
      ]
    },
    "new_market_data_requested": true,
    "no_default_multi_year_download": true,
    "user_selects_symbols_or_horizon": false
  },
  "decision": {
    "action": "FREEZE_AND_ACQUIRE_MINIMAL_DEVELOPMENT_WAVE",
    "implementation": {
      "analysis": "Report per-symbol distributions and asset-class/schedule heterogeneity first; panel aggregates remain descriptive. Do not use this wave as an independent outer evaluation for the already frozen six-symbol panel.",
      "capture": "Read-only Pepperstone cTrader/Open API capture bound to the accepted account fingerprint; exact symbol IDs and names; M5 alignment; no forward fill, synthetic bars, or resampling; duplicate and conflicting-timestamp validation; deterministic hash-bound package.",
      "sufficiency": "Require at least six active weeks, schedule-adjusted coverage of at least 0.97, zero unresolved chronology conflicts, and complete provenance before any structural result is interpreted."
    },
    "scope": {
      "interval": {
        "end_utc": "2026-09-13T23:59:59Z",
        "start_utc": "2026-07-20T00:00:00Z"
      },
      "purpose": "Non-economic structural screening only",
      "resolution": "M5",
      "symbols": [
        "XAUUSD",
        "XAGUSD",
        "BTCUSD",
        "AAPL.US",
        "AMZN.US",
        "MSFT.US",
        "META.US",
        "US30",
        "GER30",
        "UK100",
        "AUDJPY",
        "NZDUSD"
      ]
    },
    "selection_semantics": {
      "accounting_effect": {
        "economic_outcomes_opened": 0,
        "v2_attempts_consumed": 0
      },
      "economic_boundary": "No notional PnL, shared-account realization, candidate economics, V2 identity, protected forward, competition start, or live orders.",
      "promotion_rule": "Only a later separately frozen candidate methodology with broker-realistic cost authority and independent outer data may support economic interpretation.",
      "screening_procedure": "After capture, apply a prospectively frozen, mechanism-agnostic structural audit covering chronology, schedule-adjusted coverage, gap/event density, volatility and opportunity proxies, response persistence, cross-symbol dependence, and conservative friction-readiness diagnostics. Do not select or discard a mechanism family from the observed result.",
      "selection_basis": "Broker-native feasibility, asset-class and schedule diversity, expected information gain, and disjointness from the accepted C031 twelve-symbol wave and fixed six-symbol outer panel."
    }
  },
  "economic_effect": {
    "consume_v2_attempt": 0,
    "create_new_v2_identity": false,
    "open_economic_outcome": false
  },
  "next_research_state": {
    "economic_promotion_authorized": false,
    "exact_observed_identity_rerun": false,
    "family_exhaustion_claimed": false,
    "next_action": "EXECUTE_THE_FROZEN_TWELVE_SYMBOL_BROKER_NATIVE_DEVELOPMENT_CAPTURE_THEN_RUN_THE_PRECOMMITTED_MECHANISM_AGNOSTIC_STRUCTURAL_AUDIT",
    "required_gate": "Exact-head-green implementation binding and deterministic capture acceptance before structural screening.",
    "research_scope": "Broader broker-native universe remains open; this wave is development-only and cannot close any mechanism family.",
    "status": "WAITING_FOR_ACCOUNT_BOUND_READ_ONLY_CAPTURE_AND_DETERMINISTIC_ACCEPTANCE"
  },
  "objective": {
    "class": "BROKER_NATIVE_UNIVERSE_INFORMATION_GAIN_AND_STRUCTURAL_SCREENING",
    "goal": "Measure whether structurally diverse, previously untested Pepperstone-feasible instruments provide transferable opportunity density and mechanism-relevant response heterogeneity beyond the observed six-symbol session-gap panel, without opening economic outcomes.",
    "information_gain_rationale": "The confirmed MXNJPY structural result is friction-failed and the remaining fixed-panel members do not support promotion; the broader feasible universe remains open. A small stratified broker-native wave across distinct asset classes and schedules can test whether the observed behavior is localized or portable while preserving disjoint scope, multiple-testing discipline, and the no-family-closure rule."
  },
  "proposal_id": "P-20260924-BROKER-NATIVE-BREADTH-WAVE-01",
  "provider": {
    "kind": "GITHUB_COPILOT_CLI_GENERAL_REASONING",
    "model": "auto",
    "provider_version": "MXM_GENERAL_AI_REASONING_PROVIDER_V2",
    "reasoning_request_id": "reason_d5257a7d4486e220dd1360232bb7d052",
    "vendor": "GitHub Copilot"
  },
  "publication": {
    "apply_to_next_state": true
  },
  "safety": {
    "competition_start_authorized": false,
    "live_orders_authorized": false,
    "protected_forward_opened": false
  },
  "schema": "mxm.greenfield.general-ai-research-proposal.v1",
  "scope_law": {
    "mechanism_family_closure_claims": [],
    "refund_observed_attempts": false,
    "rerun_exact_observed_identity": false
  }
}
